SQL> create table Client_Master(Client_No varchar(10),Name varchar(20),City varchar(10),Pincode number(10),Bal_due number(10));

Table created.

SQL> insert  into Client_Master values('C00001','SMITHA JAIN','Mumbai',400054,15000);

1 row created.

SQL> insert  into Client_Master values('C00002','VANDANA RAO','Chennai',780001,0);

1 row created.

SQL> insert  into Client_Master values('C00003','PREM PUJARI','Mumbai',400057,5000);

1 row created.

SQL> insert  into Client_Master values('C00004','BASU NATH','Mumbai',400056,0);

1 row created.

SQL> insert  into Client_Master values('C00005','RAVI SHANKAR','Delhi',100001,2000);

1 row created.

SQL>  insert  into Client_Master values('C00006','ROOPA','Mumbai',400050,0);

1 row created.

SQL> commit;

Commit complete.

SQL> select * from Client_Master;

CLIENT_NO  NAME                 CITY          PINCODE    BAL_DUE
---------- -------------------- ---------- ---------- ----------
C00001     SMITHA JAIN          Mumbai         400054      15000
C00002     VANDANA RAO          Chennai        780001          0
C00003     PREM PUJARI          Mumbai         400057       5000
C00004     BASU NATH            Mumbai         400056          0
C00005     RAVI SHANKAR         Delhi          100001       2000
C00006     ROOPA                Mumbai         400050          0

6 rows selected.

SQL> create table Sale_Order(Order_No varchar(10),Order_Date varchar(10),Client_No varchar(15),Salesman_No varchar(10),Dely_Date varchar(10),Order_Status varchar(20));

Table created.

SQL> insert into Sale_Order values('O19001','12-01-13','C00001','S00001','20-01-13','In Process');

1 row created.

SQL> insert into Sale_Order values('O19002','25-01-13','C00002','S00002','27-01-13','Cancelled');

1 row created.

SQL> insert into Sale_Order values('O46865','18-02-13','C00003','S00003','20-02-13','Fulfilled');

1 row created.

SQL> insert into Sale_Order values('O19003','03-04-13','C00001','S00001','07-04-13','Fulfilled');

1 row created.

SQL> insert into Sale_Order values('O46866','20-05-13','C00004','S00002','07-04-13','Cancelled');

1 row created.

SQL> insert into Sale_Order values('O19008','24-05-13','C00005','S00004','26-05-13','In Process');

1 row created.

SQL> commit;

Commit complete.

SQL> select * from Sale_Order;

ORDER_NO   ORDER_DATE CLIENT_NO       SALESMAN_N DELY_DATE  ORDER_STATUS
---------- ---------- --------------- ---------- ---------- --------------------
O19001     12-01-13   C00001          S00001     20-01-13   In Process
O19002     25-01-13   C00002          S00002     27-01-13   Cancelled
O46865     18-02-13   C00003          S00003     20-02-13   Fulfilled
O19003     03-04-13   C00001          S00001     07-04-13   Fulfilled
O46866     20-05-13   C00004          S00002     07-04-13   Cancelled
O19008     24-05-13   C00005          S00004     26-05-13   In Process

6 rows selected.

SQL> select * from Client_Master where Bal_due = 0;

CLIENT_NO  NAME                 CITY          PINCODE    BAL_DUE
---------- -------------------- ---------- ---------- ----------
C00002     VANDANA RAO          Chennai        780001          0
C00004     BASU NATH            Mumbai         400056          0
C00006     ROOPA                Mumbai         400050          0

SQL> update Client_Master set City = 'Jaipur' where Client_No = 'C00004';

1 row updated.

SQL> commit;

Commit complete.

SQL> select * from Client_Master;

CLIENT_NO  NAME                 CITY          PINCODE    BAL_DUE
---------- -------------------- ---------- ---------- ----------
C00001     SMITHA JAIN          Mumbai         400054      15000
C00002     VANDANA RAO          Chennai        780001          0
C00003     PREM PUJARI          Mumbai         400057       5000
C00004     BASU NATH            Jaipur         400056          0
C00005     RAVI SHANKAR         Delhi          100001       2000
C00006     ROOPA                Mumbai         400050          0

6 rows selected.

SQL> select * from Client_Master where City = 'Mumbai';

CLIENT_NO  NAME                 CITY          PINCODE    BAL_DUE
---------- -------------------- ---------- ---------- ----------
C00001     SMITHA JAIN          Mumbai         400054      15000
C00003     PREM PUJARI          Mumbai         400057       5000
C00006     ROOPA                Mumbai         400050          0